{
    "$schema": "http://json-schema.org/draft-04/schema#",
    "title": "MDF Record",
    "type": "object",
    "description": "Schema for record entry in MDF.",
    "properties": {
        "mdf": {
            "$ref": "mdf.json#/properties/mdf"
        },
        "files": {
            "$ref": "files.json#/properties/files"
        },
        "material": {
            "$ref": "material.json#/properties/material"
        },
        "molecule": {
            "$ref": "molecule.json#/properties/molecule"
        },
        "origin": {
            "$ref": "origin.json#/properties/origin"
        },
        "calphad": {
            "$ref": "calphad.json#/properties/calphad"
        },
        "crystal_structure": {
            "$ref": "crystal_structure.json#/properties/crystal_structure"
        },
        "dft": {
            "$ref": "dft.json#/properties/dft"
        },
        "electron_microscopy": {
            "$ref": "electron_microscopy.json#/properties/electron_microscopy"
        },
        "image": {
            "$ref": "image.json#/properties/image"
        },
        "raman": {
            "$ref": "raman.json#/properties/raman"
        },
        "md": {
            "$ref": "md.json#/properties/md"
        },
        "xrd": {
            "$ref": "xrd.json#/properties/xrd"
        },
        "cross_reference": {
            "$ref": "cross_reference.json#/properties/cross_reference"
        },
        "custom": {
            "$ref": "custom.json#/properties/custom"
        },
        "projects": {
            "$ref": "projects.json#/properties/projects"
        }
    },
    "additionalProperties": false,
    "required": [
        "mdf",
        "files"
    ]
}
