{
    "mdf": {
        "source_name": "foobar",
        "source_id": "foobar_v1-2",
        "mdf_id": "abcd123",
        "scroll_id": 0,
        "parent_id": "abcd123",
        "acl": ["public"],
        "ingest_date": "2018-11-15T17:04:10.315060Z",
        "resource_type": "dataset",
        "version": 1,
        "organizations": ["Repo1", "Repo2"]
    },
    "files": [{
        "data_type": "type",
        "filename": "data.txt"
    }],
    "material": {},
    "origin": {},
    "calphad": {},
    "crystal_structure": {
        "space_group_number": 5
    },
    "dft": {},
    "electron_microscopy": {},
    "image": {},
    "md": {},
    "xrd": {}
}
